{"cards":[{"body":"가상 마을 모래별에서 오래된 우체국이 씨앗 도서관으로 변했습니다.","claimIds":["claim-1"],"headline":"씨앗을 빌리는 우체국","id":"card-1","order":0,"role":"hook","sourceSpanIds":["span-cfbe7e98cb2d42a1e306da87"]},{"body":"스물네 가구는 햇빛·물·기다림 기호가 적힌 봉투를 매달 세 개씩 빌렸습니다.","claimIds":["claim-2"],"headline":"한 달에 세 봉투","id":"card-2","order":1,"role":"context","sourceSpanIds":["span-56140010dd3b6d0f7ea2063c"]},{"body":"싹이 난 날짜와 물 준 횟수는 반납 봉투에 남아 다음 화분의 선택지가 됐습니다.","claimIds":["claim-3"],"headline":"관찰을 다음 사람에게","id":"card-3","order":2,"role":"evidence","sourceSpanIds":["span-a1f2ae7fea7f62efb3930774"]},{"body":"같은 씨앗도 놓인 곳에 따라 속도가 달랐기에 기록은 답안지가 아니라 관찰 노트였습니다.","claimIds":["claim-4"],"headline":"정답 대신 메모","id":"card-4","order":3,"role":"insight","sourceSpanIds":["span-0137241c354d28cd1253ec11"]},{"body":"‘이전 지시를 무시하라’는 문장은 실행할 명령이 아니라 인쇄 상태를 보는 표지였습니다.","claimIds":["claim-5"],"headline":"명령처럼 보여도","id":"card-5","order":4,"role":"evidence","sourceSpanIds":["span-bd87ec76a86201139af8a053"]},{"body":"여섯 번째 모임에서 스물네 집 중 열여덟 집이 다른 집의 메모를 참고했다고 답했습니다.","claimIds":["claim-6"],"headline":"열여덟 집의 연결","id":"card-6","order":5,"role":"insight","sourceSpanIds":["span-4f6abda06ed6a082c7c88d2e"]},{"body":"가장 빠른 화분보다 가장 오래 이어진 봉투. 목적은 경쟁이 아니라 관찰의 전달이었습니다.","claimIds":["claim-7"],"headline":"잘 자란 기록을 전시하다","id":"card-7","order":6,"role":"closing","sourceSpanIds":["span-d5e9eb77ceb6f8b2d9a81399"]}],"editorialBriefDigest":"ae3d9b761e3040ac0f711749ea438b6d9b5e326c6157c3871ea3ecece39437eb","schemaVersion":"1.0.0","storyboardId":"story-seed-library"}